Title,Authors,Link
Mammalian and Invertebrate Models as Complementary Tools for Gaining Mechanistic Insight on Muscle Responses to Spaceflight,"Thomas Cahill, Henry Cope, Joseph J Bass, Eliah G Overbey, Rachel Gilbert, Willian Abraham da Silveira, Amber M Paul, Tejaswini Mishra, Raúl Herranz, Sigrid S Reinsch, Sylvain V Costes, Gary Hardiman, Nathaniel J Szewczyk, Candice G T Tahimic",https://www.ncbi.nlm.nih.gov/pmc/articles/PMC8430797/
Investigation of simulated microgravity effects onStreptococcus mutansphysiology and global gene expression,"Silvia S Orsini, April M Lewis, Kelly C Rice",https://www.ncbi.nlm.nih.gov/pmc/articles/PMC5460135/
Altered quorum sensing and physiology ofStaphylococcus aureusduring spaceflight detected by multi-omics data analysis,"Matthew R Hauserman, Mariola J Ferraro, Ronan K Carroll, Kelly C Rice",https://www.ncbi.nlm.nih.gov/pmc/articles/PMC10774393/
"Phosphoinositides control the localization of HOPS subunit VPS41, which together with VPS33 mediates vacuole fusion in plants","Carla Brillada, Jiameng Zheng, Falco Krüger, Eliezer Rovira-Diaz, Jana Christin Askani, Karin Schumacher, Marcela Rojas-Pierce",https://www.ncbi.nlm.nih.gov/pmc/articles/PMC6126739/
REGULATOR OF BULB BIOGENESIS1 (RBB1) Is Involved in Vacuole Bulb Formation in Arabidopsis,"Sang Won Han, Jose M Alonso, Marcela Rojas-Pierce",https://www.ncbi.nlm.nih.gov/pmc/articles/PMC4411111/
"Phosphoinositides control the localization of HOPS subunit VPS41, which together with VPS33 mediates vacuole fusion in plants","Carla Brillada, Jiameng Zheng, Falco Krüger, Eliezer Rovira-Diaz, Jana Christin Askani, Karin Schumacher, Marcela Rojas-Pierce",https://www.ncbi.nlm.nih.gov/pmc/articles/PMC6126739/
Microgravity enhances the phenotype ofArabidopsis zigzag-1and reduces the Wortmannin-induced vacuole fusion in root cells,"Mengying Wang, Katherine Danz, Vanessa Ly, Marcela Rojas-Pierce",https://www.ncbi.nlm.nih.gov/pmc/articles/PMC9445043/
Hypergravity disruption of homeorhetic adaptations to lactation in rat dams include changes in circadian clocks,"Theresa Casey, Elzbieta I Zakrzewska, Rhonda L Maple, Laura Lintault, Charles E Wade, Lisa A Baer, April E Ronca, Karen Plaut",https://www.ncbi.nlm.nih.gov/pmc/articles/PMC3509447/
Intrauterine exposure to maternal stress altersBdnf IVDNA methylation and telomere length in the brain of adult rat offspring,"Jennifer Blaze, Arun Asok, Kristyn Borrelli, Christina Tulbert, Justin Bollinger, April E Ronca, Tania L Roth",https://www.ncbi.nlm.nih.gov/pmc/articles/PMC5600826/
Sex differences in muscle health in simulated micro- and partial-gravity environments in rats,"Megan E Rosa-Caldwell, Marie Mortreux, Anna Wadhwa, Ursula B Kaiser, Dong-Min Sung, Mary L Bouxsein, Seward B Rutkove",https://www.ncbi.nlm.nih.gov/pmc/articles/PMC10831389/
Sex differences in muscle health in simulated micro- and partial-gravity environments in rats,"Megan E Rosa-Caldwell, Marie Mortreux, Anna Wadhwa, Ursula B Kaiser, Dong-Min Sung, Mary L Bouxsein, Seward B Rutkove",https://www.ncbi.nlm.nih.gov/pmc/articles/PMC10831389/
Brassinazole resistant 1 (BZR1)-dependent brassinosteroid signalling pathway leads to ectopic activation of quiescent cell division and suppresses columella stem cell differentiation,"Hak-Soo Lee, Yoon Kim, Giang Pham, Ju Won Kim, Ji-Hye Song, Yew Lee, Yong-Sic Hwang, Stanley J Roux, Soo-Hwan Kim",https://www.ncbi.nlm.nih.gov/pmc/articles/PMC4507784/
Proteomic Study of Microsomal Proteins Reveals a Key Role forArabidopsisAnnexin 1 in Mediating Heat Stress-Induced Increase in Intracellular Calcium Levels*,"Xu Wang, Xiaolong Ma, Hui Wang, Bingjie Li, Greg Clark, Yi Guo, Stan Roux, Daye Sun, Wenqiang Tang",https://www.ncbi.nlm.nih.gov/pmc/articles/PMC4349987/
Apyrase inhibitors enhance the ability of diverse fungicides to inhibit the growth of different plant‐pathogenic fungi,"Manas Kumar Tripathy, Gayani Weeraratne, Greg Clark, Stanley J Roux",https://www.ncbi.nlm.nih.gov/pmc/articles/PMC6638264/
"ANN1 and ANN2 Function in Post-Phloem Sugar Transport in Root Tips to Affect Primary Root Growth1,[OPEN]","Jing Wang, Jawon Song, Greg Clark, Stanley J Roux",https://www.ncbi.nlm.nih.gov/pmc/articles/PMC6130020/
Mitochondria-Targeted Human Catalase in the Mouse Longevity MCAT Model Mitigates Head-Tilt Bedrest-Induced Neuro-Inflammation in the Hippocampus,"Linda Rubinstein, Frederico Kiffer, Stephanie Puukila, Moniece G Lowe, Brie Goo, Amalia Luthens, Ann-Sofie Schreurs, Samantha M Torres, Sonette Steczina, Candice G T Tahimic, Antiño R Allen",https://www.ncbi.nlm.nih.gov/pmc/articles/PMC9695374/
Structural and functional properties of bone are compromised in amyotrophic lateral sclerosis mice,"Frank C Ko, Jia Li, Daniel J Brooks, Seward B Rutkove, Mary L Bouxsein",https://www.ncbi.nlm.nih.gov/pmc/articles/PMC6141014/
Longitudinal time course of muscle impairments during partial weight-bearing in rats,"Marie Mortreux, Frank C Ko, Daniela Riveros, Mary L Bouxsein, Seward B Rutkove",https://www.ncbi.nlm.nih.gov/pmc/articles/PMC6706399/
Blood Flow Restriction Training: A Tool to Enhance Rehabilitation and Build Athlete Resiliency,Mark Murphy,https://www.ncbi.nlm.nih.gov/pmc/articles/PMC12034070/
Dose-dependent skeletal deficits due to varied reductions in mechanical loading in rats,"Frank C Ko, Marie Mortreux, Daniela Riveros, Janice A Nagy, Seward B Rutkove, Mary L Bouxsein",https://www.ncbi.nlm.nih.gov/pmc/articles/PMC7235020/
Approaching Gravity as a Continuum Using the Rat Partial Weight-Bearing Model,"Marie Mortreux, Megan E Rosa-Caldwell",https://www.ncbi.nlm.nih.gov/pmc/articles/PMC7599661/
Hindlimb suspension in Wistar rats: Sex‐based differences in muscle response,"Marie Mortreux, Megan E Rosa‐Caldwell, Ian D Stiehl, Dong‐Min Sung, Nicholas T Thomas, Christopher S Fry, Seward B Rutkove",https://www.ncbi.nlm.nih.gov/pmc/articles/PMC8493566/
Correction to “Adaptation to full weight‐bearing following disuse in rats: The impact of biological sex on musculoskeletal recovery”,,https://www.ncbi.nlm.nih.gov/pmc/articles/PMC10926278/
Effects of liquid cultivation on gene expression and phenotype ofC. elegans,"İrem Çelen, Jung H Doh, Chandran R Sabanayagam",https://www.ncbi.nlm.nih.gov/pmc/articles/PMC6069985/
Transcriptomic Signature of the Simulated Microgravity Response inCaenorhabditis elegansand Comparison to Spaceflight Experiments,"İrem Çelen, Aroshan Jayasinghe, Jung H Doh, Chandran R Sabanayagam",https://www.ncbi.nlm.nih.gov/pmc/articles/PMC9856674/
Enabling Clonal Analyses of Yeast in Outer Space by Encapsulation and Desiccation in Hollow Microparticles,"Simon Ng, Cayden Williamson, Mark van Zee, Dino Di Carlo, Sergio R Santa Maria",https://www.ncbi.nlm.nih.gov/pmc/articles/PMC9410522/
Caenorhabditis elegansin microgravity: An omics perspective,"Amanda Scott, Craig RG Willis, Masafumi Muratani, Atsushi Higashitani, Timothy Etheridge, Nathaniel J Szewczyk, Colleen S Deane",https://www.ncbi.nlm.nih.gov/pmc/articles/PMC10344948/
Dried plum diet protects from bone loss caused by ionizing radiation,"A-S Schreurs, Y Shirazi-Fard, M Shahnazari, J S Alwood, T A Truong, C G T Tahimic, C L Limoli, N D Turner, B Halloran, R K Globus",https://www.ncbi.nlm.nih.gov/pmc/articles/PMC4750446/
Dietary countermeasure mitigates simulated spaceflight-induced osteopenia in mice,"Sonette Steczina, Candice G T Tahimic, Megan Pendleton, Ons M’Saad, Moniece Lowe, Joshua S Alwood, Bernard P Halloran, Ruth K Globus, Ann-Sofie Schreurs",https://www.ncbi.nlm.nih.gov/pmc/articles/PMC7162976/
Simulated Microgravity Alters Gene Regulation Linked to Immunity and Cardiovascular Disease,"Candice G T Tahimic, Sonette Steczina, Aimy Sebastian, Nicholas R Hum, Metadel Abegaz, Masahiro Terada, Maria Cimini, David A Goukassian, Ann-Sofie Schreurs, Tana M Hoban-Higgins, Charles A Fuller, Gabriela G Loots, Ruth K Globus, Yasaman Shirazi-Fard",https://www.ncbi.nlm.nih.gov/pmc/articles/PMC11353732/
Identification of therapeutic targets for chronic kidney disease through Mendelian randomization analysis of druggable genes,"Run-Sen Liang, Jin-Qi Su, Xiang-Qi Wu, Qi Wang, Yong-Mei Cai, Hong-Yong Su, Ji-Xin Tang, Cui-Wei Yao",https://www.ncbi.nlm.nih.gov/pmc/articles/PMC11953390/
A New Role of NAP1L1 in Megakaryocytes and Human Platelets,"Martin Freitag, Hansjörg Schwertz",https://www.ncbi.nlm.nih.gov/pmc/articles/PMC9737020/
Evaluation of rodent spaceflight in the NASA animal enclosure module for an extended operational period (up to 35 days),"Eric L Moyer, Paula M Dumars, Gwo-Shing Sun, Kara J Martin, David G Heathcote, Richard D Boyle, Mike G Skidmore",https://www.ncbi.nlm.nih.gov/pmc/articles/PMC5515519/
Morphology ofPenicillium rubensBiofilms Formed in Space,"Megan Hupka, Raj Kedia, Rylee Schauer, Brooke Shepard, María Granados-Presa, Mark Vande Hei, Pamela Flores, Luis Zea",https://www.ncbi.nlm.nih.gov/pmc/articles/PMC10144393/
Explainable machine learning identifies multi-omics signatures of muscle response to spaceflight in mice,"Kevin Li, Riya Desai, Ryan T Scott, Joel Ricky Steele, Meera Machado, Samuel Demharter, Adrienne Hoarfrost, Jessica L Braun, Val A Fajardo, Lauren M Sanders, Sylvain V Costes",https://www.ncbi.nlm.nih.gov/pmc/articles/PMC10719374/
Microbial adaptation to spaceflight is correlated with bacteriophage-encoded functions,"Iris Irby, Jared T Broddrick",https://www.ncbi.nlm.nih.gov/pmc/articles/PMC11096397/
Influence of the spaceflight environment on macrophage lineages,"Rocky An, Virginia Katherine Blackwell, Bijan Harandi, Alicia C Gibbons, Olivia Siu, Iris Irby, Amy Rees, Nadjet Cornejal, Kristina M Sattler, Tao Sheng, Nicholas C Syracuse, David Loftus, Sergio R Santa Maria, Egle Cekanaviciute, Sigrid S Reinsch, Hami E Ray, Amber M Paul",https://www.ncbi.nlm.nih.gov/pmc/articles/PMC11166655/
MARSBOx: Fungal and Bacterial Endurance From a Balloon-Flown Analog Mission in the Stratosphere,"Marta Cortesão, Katharina Siems, Stella Koch, Kristina Beblo-Vranesevic, Elke Rabbow, Thomas Berger, Michael Lane, Leandro James, Prital Johnson, Samantha M Waters, Sonali D Verma, David J Smith, Ralf Moeller",https://www.ncbi.nlm.nih.gov/pmc/articles/PMC7937622/
In situLinkage of Fungal and Bacterial Proliferation to Microbiologically Influenced Corrosion in B20 Biodiesel Storage Tanks,"Blake W Stamps, Caitlin L Bojanowski, Carrie A Drake, Heather S Nunn, Pamela F Lloyd, James G Floyd, Katelyn A Emmerich, Abby R Neal, Wendy J Crookes-Goodson, Bradley S Stevenson",https://www.ncbi.nlm.nih.gov/pmc/articles/PMC7055474/
"Identification of Metagenome-Assembled Genomes Containing Antimicrobial Resistance Genes, Isolated from an Advanced Water Treatment Facility","Blake W Stamps, John R Spear",https://www.ncbi.nlm.nih.gov/pmc/articles/PMC7118179/
Nature of Pre-Earthquake Phenomena and their Effects on Living Organisms,"Friedemann Freund, Viktor Stolc",https://www.ncbi.nlm.nih.gov/pmc/articles/PMC4494396/
The rapid diagnosis and effective inhibition of coronavirus using spike antibody attached gold nanoparticles†,"Avijit Pramanik, Ye Gao, Shamily Patibandla, Dipanwita Mitra, Martin G McCandless, Lauren A Fassero, Kalein Gates, Ritesh Tandon, Paresh Chandra Ray",https://www.ncbi.nlm.nih.gov/pmc/articles/PMC8323809/
"Blocking SARS-CoV-2 Delta Variant (B.1.617.2)
Spike Protein Receptor-Binding Domain Binding with the ACE2 Receptor
of the Host Cell and Inhibiting Virus Infections Using Human Host
Defense Peptide-Conjugated Graphene Quantum Dots","Avijit Pramanik, Poonam C Sharma, Shamily Patibandla, Ye Gao, Vinod Ruppa-Kasani, Jagruti Goli, Animesh Kumar, Abhirup Chatterjee, Sudarson Sekhar Sinha, John T Bates, Michael A Bierdeman, Ritesh Tandon, Paresh Chandra Ray",https://www.ncbi.nlm.nih.gov/pmc/articles/PMC8886715/
Safety and Pharmacokinetics of Intranasally Administered Heparin,"Hannah M Harris, Katherine L Boyet, Hao Liu, Rohini Dwivedi, Nicole M Ashpole, Ritesh Tandon, Gene L Bidwell, III, Zhi Cheng, Lauren A Fassero, Christian S Yu, Vitor H Pomin, Dipanwita Mitra, Kerri A Harrison, Eric Dahl, Bill J Gurley, Arun Kumar Kotha, Mahavir Bhupal Chougule, Joshua S Sharp",https://www.ncbi.nlm.nih.gov/pmc/articles/PMC8890767/
Inhibition of SARS-CoV-2 wild-type (Wuhan-Hu-1) and Delta (B.1.617.2) strains by marine sulfated glycans,"Rohini Dwivedi, Poonam Sharma, Marwa Farrag, Seon Beom Kim, Lauren A Fassero, Ritesh Tandon, Vitor H Pomin",https://www.ncbi.nlm.nih.gov/pmc/articles/PMC9487896/
Inhibition of Cytomegalovirus byPentacta pygmaeaFucosylated Chondroitin Sulfate Depends on Its Molecular Weight,"Poonam Sharma, Rohini Dwivedi, Priya Ray, Jayanti Shukla, Vitor H Pomin, Ritesh Tandon",https://www.ncbi.nlm.nih.gov/pmc/articles/PMC10142442/
Effect of Simulated Cosmic Radiation on Cytomegalovirus Reactivation and Lytic Replication,"Satish K Mehta, Douglass M Diak, Sara Bustos-Lopez, Mayra Nelman-Gonzalez, Xi Chen, Ianik Plante, Stephen J Stray, Ritesh Tandon, Brian E Crucian",https://www.ncbi.nlm.nih.gov/pmc/articles/PMC11477029/
A Tissue Retrieval and Postharvest Processing Regimen for Rodent Reproductive Tissues Compatible with Long-Term Storage on the International Space Station and Postflight Biospecimen Sharing Program,"Vijayalaxmi Gupta, Lesya Holets-Bondar, Katherine F Roby, George Enders, Joseph S Tash",https://www.ncbi.nlm.nih.gov/pmc/articles/PMC4309301/
Spaceflight induces changes in gene expression profiles linked to insulin and estrogen,"Begum Aydogan Mathyk, Marshall Tabetah, Rashid Karim, Victoria Zaksas, JangKeun Kim, R I Anu, Masafumi Muratani, Alexia Tasoula, Ruth Subhash Singh, Yen-Kai Chen, Eliah Overbey, Jiwoon Park, Henry Cope, Hossein Fazelinia, Davide Povero, Joseph Borg, Remi V Klotz, Min Yu, Steven L Young, Christopher E Mason, Nathaniel Szewczyk, Riley M St Clair, Fathi Karouia, Afshin Beheshti",https://www.ncbi.nlm.nih.gov/pmc/articles/PMC11166981/
The multiscale structural and mechanical effects of mouse supraspinatus muscle unloading on the mature enthesis,"Alix C Deymier, Andrea G Schwartz, Zhounghou Cai, Tyrone L Daulton, Jill D Pasteris, Guy M Genin, Stavros Thomopoulos",https://www.ncbi.nlm.nih.gov/pmc/articles/PMC6343501/
Multiscale effects of spaceflight on murine tendon and bone,"Alix C Deymier, Andrea G Schwartz, Chanteak Lim, Brian Wingender, Akhilesh Kotiya, Hua Shen, Matthew J Silva, Stavros Thomopoulos",https://www.ncbi.nlm.nih.gov/pmc/articles/PMC7138367/
Reproducible changes in the gut microbiome suggest a shift in microbial and host metabolism during spaceflight,"Peng Jiang, Stefan J Green, George E Chlipala, Fred W Turek, Martha Hotz Vitaterna",https://www.ncbi.nlm.nih.gov/pmc/articles/PMC6689164/
Failure to Generate Bone Marrow Adipocytes Does Not Protect Mice from Ovariectomy-Induced Osteopenia,"Urszula T Iwaniec, Russell T Turner",https://www.ncbi.nlm.nih.gov/pmc/articles/PMC3564669/
Acute Exposure to High Dose γ-Radiation Results in Transient Activation of Bone Lining Cells,"Russell T Turner, Urszula T Iwaniec, Carmen P Wong, Laurence B Lindenmaier, Lindsay A Wagner, Adam J Branscum, Scott A Menn, James Taylor, Ye Zhang, Honglu Wu, Jean D Sibonga",https://www.ncbi.nlm.nih.gov/pmc/articles/PMC4042434/
Morbid Obesity Attenuates the Skeletal Abnormalities Associated with Leptin Deficiency in Mice,"Russell T Turner, Kenneth A Philbrick, Carmen P Wong, Dawn A Olson, Adam J Branscum, Urszula T Iwaniec",https://www.ncbi.nlm.nih.gov/pmc/articles/PMC4161659/
Hypothalamic Leptin Gene Therapy Reduces Body Weight without Accelerating Age-Related Bone Loss,"Russell T Turner, Michael Dube, Adam J Branscum, Carmen P Wong, Dawn A Olson, Xiaoying Zhong, Mercedes F Kweh, Iske V Larkin, Thomas J Wronski, Clifford J Rosen, Satya P Kalra, Urszula T Iwaniec",https://www.ncbi.nlm.nih.gov/pmc/articles/PMC4917201/
Hypothalamic Leptin Gene Therapy Reduces Bone Marrow Adiposity inob/obMice Fed Regular and High-Fat Diets,"Laurence B Lindenmaier, Kenneth A Philbrick, Adam J Branscum, Satya P Kalra, Russell T Turner, Urszula T Iwaniec",https://www.ncbi.nlm.nih.gov/pmc/articles/PMC4985531/
Room Temperature Housing Results in Premature Cancellous Bone Loss in Growing Female Mice: Implications for the Mouse as a Preclinical Model for Age-Related Bone Loss,"Urszula T Iwaniec, Kenneth A Philbrick, Carmen P Wong, Jody L Gordon, Arianna M Kahler-Quesada, Dawn A Olson, Adam J Branscum, Jennifer L Sargent, Victoria E DeMambro, Clifford J Rosen, Russell T Turner",https://www.ncbi.nlm.nih.gov/pmc/articles/PMC5421618/
Spaceflight-induced vertebral bone loss in ovariectomized rats is associated with increased bone marrow adiposity and no change in bone formation,"Jessica A Keune, Kenneth A Philbrick, Adam J Branscum, Urszula T Iwaniec, Russell T Turner",https://www.ncbi.nlm.nih.gov/pmc/articles/PMC5515514/
The Role of Estrogen Receptor α in Response to Longitudinal Bone Growth in ob/ob Mice,"Lin-Yu Jin, Chen Guo, Shuai Xu, Hai-Ying Liu, Xin-Feng Li",https://www.ncbi.nlm.nih.gov/pmc/articles/PMC8671758/
Effects of hypothalamic leptin gene therapy on osteopetrosis in leptin-deficient mice,"Kenneth A Philbrick, Stephen A Martin, Amy R Colagiovanni, Adam J Branscum, Russell T Turner, Urszula T Iwaniec",https://www.ncbi.nlm.nih.gov/pmc/articles/PMC5771473/
Leptin Stimulates Bone Formation inob/obMice at Doses Having Minimal Impact on Energy Metabolism,"Kenneth A Philbrick, Carmen P Wong, Adam J Branscum, Russell T Turner, Urszula T Iwaniec",https://www.ncbi.nlm.nih.gov/pmc/articles/PMC5288125/
Bone Marrow Adipose Tissue Deficiency Increases Disuse-Induced Bone Loss in Male Mice,"Jessica A Keune, Carmen P Wong, Adam J Branscum, Urszula T Iwaniec, Russell T Turner",https://www.ncbi.nlm.nih.gov/pmc/articles/PMC5389344/
Mannose Receptor Deficiency Impacts Bone Marrow and Circulating Immune Cells during High Fat Diet Induced Obesity,"Jasmine Nour, Annalisa Moregola, Monika Svecla, Lorenzo Da Dalt, Rossella Bellini, Olivier Neyrolles, Gian Paolo Fadini, Yoann Rombouts, Mattia Albiero, Fabrizia Bonacina, Giuseppe Danilo Norata",https://www.ncbi.nlm.nih.gov/pmc/articles/PMC9784906/
Maintenance of Near Normal Bone Mass and Architecture in Lethally Irradiated Female Mice following Adoptive Transfer with as few as 750 Purified Hematopoietic Stem Cells,"Richard T Deyhle, Jr, Carmen P Wong, Stephen A Martin, Melissa Q McDougall, Dawn A Olson, Adam J Branscum, Scott A Menn, Urszula T Iwaniec, David M Hamby, Russell T Turner",https://www.ncbi.nlm.nih.gov/pmc/articles/PMC6548323/
Effect of Leptin Deficiency on the Skeletal Response to Hindlimb Unloading in Adult Male Mice,"Jessica A Keune, Adam J Branscum, Carmen P Wong, Urszula T Iwaniec, Russell T Turner",https://www.ncbi.nlm.nih.gov/pmc/articles/PMC6597714/
Thermoneutral housing attenuates premature cancellous bone loss in male C57BL/6J mice,"Stephen A Martin, Kenneth A Philbrick, Carmen P Wong, Dawn A Olson, Adam J Branscum, Donald B Jump, Charles K Marik, Jonathan M DenHerder, Jennifer L Sargent, Russell T Turner, Urszula T Iwaniec",https://www.ncbi.nlm.nih.gov/pmc/articles/PMC6865368/
Effects of spaceflight on cancellous and cortical bone in proximal femur in growing rats☆,"Amanda Gamboa, Adam J Branscum, Dawn A Olson, Lara H Sattgast, Urszula T Iwaniec, Russell T Turner",https://www.ncbi.nlm.nih.gov/pmc/articles/PMC7907224/
Evidence for increased thermogenesis in female C57BL/6J mice housed aboard the international space station,"Carmen P Wong, Urszula T Iwaniec, Russell T Turner",https://www.ncbi.nlm.nih.gov/pmc/articles/PMC8213760/
Leptin and environmental temperature as determinants of bone marrow adiposity in female mice,"Russell T Turner, Kira L Nesser, Kenneth A Philbrick, Carmen P Wong, Dawn A Olson, Adam J Branscum, Urszula T Iwaniec",https://www.ncbi.nlm.nih.gov/pmc/articles/PMC9582271/
Small changes in thermoregulation influence cancellous bone turnover balance in distal femur metaphysis in growing female mice,"Lara H Sattgast, Carmen P Wong, Adam J Branscum, Dawn A Olson, Allan M Aguirre-Burk, Urszula T Iwaniec, Russell T Turner",https://www.ncbi.nlm.nih.gov/pmc/articles/PMC10063413/
Bone Marrow Adipose Tissue Is Not Required for Reconstitution of the Immune System following Irradiation in Male Mice,"Jessica A Keune, Carmen P Wong, Adam J Branscum, Scott A Menn, Urszula T Iwaniec, Russell T Turner",https://www.ncbi.nlm.nih.gov/pmc/articles/PMC10889206/
Simulated Microgravity Promotes Horizontal Gene Transfer of Antimicrobial Resistance Genes between Bacterial Genera in the Absence of Antibiotic Selective Pressure,"Camilla Urbaniak, Tristan Grams, Christopher E Mason, Kasthuri Venkateswaran",https://www.ncbi.nlm.nih.gov/pmc/articles/PMC8468678/
Understanding the Complexities and Changes of the Astronaut Microbiome for Successful Long-Duration Space Missions,"Donatella Tesei, Anna Jewczynko, Anne M Lynch, Camilla Urbaniak",https://www.ncbi.nlm.nih.gov/pmc/articles/PMC9031868/
Toward sustainable space exploration: a roadmap for harnessing the power of microorganisms,"Rosa Santomartino, Nils J H Averesch, Marufa Bhuiyan, Charles S Cockell, Jesse Colangelo, Yosephine Gumulya, Benjamin Lehner, Ivanna Lopez-Ayala, Sean McMahon, Anurup Mohanty, Sergio R Santa Maria, Camilla Urbaniak, Rik Volger, Jiseon Yang, Luis Zea",https://www.ncbi.nlm.nih.gov/pmc/articles/PMC10030976/
Roll maneuvers are essential for active reorientation ofCaenorhabditis elegansin 3D media,"Alejandro Bilbao, Amar K Patel, Mizanur Rahman, Siva A Vanapalli, Jerzy Blawzdziewicz",https://www.ncbi.nlm.nih.gov/pmc/articles/PMC5910807/
Development of a size-separation technique to isolateCaenorhabditis elegansembryos using mesh filters,"Nikita S Jhaveri, Maya K Mastronardo, JB Collins, Erik C Andersen",https://www.ncbi.nlm.nih.gov/pmc/articles/PMC12021249/
NemaFlex: A microfluidics-based technology for standardized measurement of muscular strength ofC. elegans,"Mizanur Rahman, Jennifer E Hewitt, Frank Van-Bussel, Hunter Edwards, Jerzy Blawzdziewicz, Nathaniel J Szewczyk, Monica Driscoll, Siva A Vanapalli",https://www.ncbi.nlm.nih.gov/pmc/articles/PMC6057834/
"Swim exercise inCaenorhabditis elegansextends neuromuscular and gut healthspan, enhances learning ability, and protects against neurodegeneration","Ricardo Laranjeiro, Girish Harinath, Jennifer E Hewitt, Jessica H Hartman, Mary Anne Royal, Joel N Meyer, Siva A Vanapalli, Monica Driscoll",https://www.ncbi.nlm.nih.gov/pmc/articles/PMC6876156/
Molecular Muscle Experiment: Hardware and Operational Lessons for Future Astrobiology Space Experiments,"Amelia K Pollard, Christopher J Gaffney, Colleen S Deane, Michele Balsamo, Michael Cooke, Rebecca A Ellwood, Jennifer E Hewitt, Beata E Mierzwa, Alessandro Mariani, Siva A Vanapalli, Timothy Etheridge, Nathaniel J Szewczyk",https://www.ncbi.nlm.nih.gov/pmc/articles/PMC7415877/
Tart Cherry Increases Lifespan inCaenorhabditis elegansby Altering Metabolic Signaling Pathways,"Shasika Jayarathne, Latha Ramalingam, Hunter Edwards, Siva A Vanapalli, Naima Moustaid-Moussa",https://www.ncbi.nlm.nih.gov/pmc/articles/PMC7285199/
A Region of UNC-89 (obscurin) Lying Between Two Protein Kinase Domains is a Highly Elastic Spring Required for Proper Sarcomere Organization,"Hiroshi Qadota, Jasmine C Moody, Leila Lesanpezeshki, Taylor Moncrief, Deborah Kitzler, Purnima Devaki Bhat, Siva A Vanapalli, Andres F Oberhauser, Guy M Benian",https://www.ncbi.nlm.nih.gov/pmc/articles/PMC9549344/
NemaLife chip: a micropillar-based microfluidic culture device optimized for aging studies in crawlingC. elegans,"Mizanur Rahman, Hunter Edwards, Nikolajs Birze, Rebecca Gabrilska, Kendra P Rumbaugh, Jerzy Blawzdziewicz, Nathaniel J Szewczyk, Monica Driscoll, Siva A Vanapalli",https://www.ncbi.nlm.nih.gov/pmc/articles/PMC7530743/
Spaceflight affects neuronal morphology and alters transcellular degradation of neuronal debris in adultCaenorhabditis elegans,"Ricardo Laranjeiro, Girish Harinath, Amelia K Pollard, Christopher J Gaffney, Colleen S Deane, Siva A Vanapalli, Timothy Etheridge, Nathaniel J Szewczyk, Monica Driscoll",https://www.ncbi.nlm.nih.gov/pmc/articles/PMC7890410/
Microfluidics-integrated spaceflight hardware for measuring muscle strength ofCaenorhabditis eleganson the International Space Station,"Purushottam Soni, Taslim Anupom, Leila Lesanpezeshki, Mizanur Rahman, Jennifer E Hewitt, Matthew Vellone, Louis Stodieck, Jerzy Blawzdziewicz, Nathaniel J Szewczyk, Siva A Vanapalli",https://www.ncbi.nlm.nih.gov/pmc/articles/PMC9640571/
A Compact Imaging Platform for ConductingC. elegansPhenotypic Assays on Earth and in Spaceflight,"Taslim Anupom, Siva A Vanapalli",https://www.ncbi.nlm.nih.gov/pmc/articles/PMC9862956/
Mitochondrial sulfide promotes life span and health span through distinct mechanisms in developing versus adult treatedCaenorhabditis elegans,"Adriana Raluca Vintila, Luke Slade, Michael Cooke, Craig R G Willis, Roberta Torregrossa, Mizanur Rahman, Taslim Anupom, Siva A Vanapalli, Christopher J Gaffney, Nima Gharahdaghi, Csaba Szabo, Nathaniel J Szewczyk, Matthew Whiteman, Timothy Etheridge",https://www.ncbi.nlm.nih.gov/pmc/articles/PMC10410709/
Bisphosphonates attenuate age‐related muscle decline inCaenorhabditis elegans,"Luke Slade, Shelby E Bollen, Joseph J Bass, Bethan E Phillips, Kenneth Smith, Daniel J Wilkinson, Nathaniel J Szewczyk, Philip J Atherton, Timothy Etheridge",https://www.ncbi.nlm.nih.gov/pmc/articles/PMC10751425/
Spaceflight Induces Strength Decline inCaenorhabditis elegans,"Purushottam Soni, Hunter Edwards, Taslim Anupom, Mizanur Rahman, Leila Lesanpezeshki, Jerzy Blawzdziewicz, Henry Cope, Nima Gharahdaghi, Daniel Scott, Li Shean Toh, Philip M Williams, Timothy Etheridge, Nathaniel Szewczyk, Craig R G Willis, Siva A Vanapalli",https://www.ncbi.nlm.nih.gov/pmc/articles/PMC10605753/
